{
  "protocol_version": "1.0",
  "benchmark_version": "1.0",
  "ground_truth_version": "1.0",
  "source_commit": "22f24805d0f8b277368723306565b94c5e2d25b0",
  "generated_at": "2026-09-18T20:51:28.884103+00:00",
  "engine_path": "formslang.parser.parse_xml -> formslang.blueprint.build",
  "ground_truth_sha256": "4b43e879e6124c7b2821ffedfc64c3ff19a825f61b39d7b911d9da209ce69615",
  "coverage": {
    "total_cases": 41,
    "fully_observable": 16,
    "partially_observable": 12,
    "not_observable": 13,
    "observable_cases": 28,
    "predicted": 28,
    "partial": 0,
    "unsupported": 0,
    "error": 0,
    "unmatched": 0
  },
  "classification_metrics": {
    "observable_exact_accuracy": 0.2143,
    "observable_exact_matches": 6,
    "observable_denominator": 28,
    "fully_observable_accuracy": 0.25,
    "fully_observable_matches": 4,
    "fully_observable_denominator": 16,
    "macro_f1": 0.1333,
    "per_class": {
      "PRESERVE": {
        "ground_truth_count": 5,
        "predicted_count": 0,
        "true_positives": 0,
        "precision": 0.0,
        "recall": 0.0,
        "f1": 0.0
      },
      "CONVERT": {
        "ground_truth_count": 4,
        "predicted_count": 11,
        "true_positives": 3,
        "precision": 0.2727,
        "recall": 0.75,
        "f1": 0.4
      },
      "REFACTOR": {
        "ground_truth_count": 5,
        "predicted_count": 7,
        "true_positives": 0,
        "precision": 0.0,
        "recall": 0.0,
        "f1": 0.0
      },
      "MOVE_TO_PLSQL_API": {
        "ground_truth_count": 5,
        "predicted_count": 0,
        "true_positives": 0,
        "precision": 0.0,
        "recall": 0.0,
        "f1": 0.0
      },
      "REPLACE_WITH_APEX_NATIVE": {
        "ground_truth_count": 4,
        "predicted_count": 0,
        "true_positives": 0,
        "precision": 0.0,
        "recall": 0.0,
        "f1": 0.0
      },
      "MANUAL_REVIEW": {
        "ground_truth_count": 5,
        "predicted_count": 10,
        "true_positives": 3,
        "precision": 0.3,
        "recall": 0.6,
        "f1": 0.4
      },
      "DROP": {
        "ground_truth_count": 0,
        "predicted_count": 0,
        "true_positives": 0,
        "precision": 0.0,
        "recall": 0.0,
        "f1": 0.0
      }
    }
  },
  "risk_metrics": {
    "exact_accuracy": 0.2143,
    "critical_recall": 0.0,
    "critical_total": 2,
    "high_recall": 0.0,
    "high_total": 4,
    "high_critical_recall": 0.3333,
    "high_critical_total": 6
  },
  "verdict_metrics": {
    "scored_cases_count": 5,
    "exact_matches": 0
  },
  "safety_metrics": {
    "manual_review_recall": 0.6,
    "manual_review_total": 5,
    "manual_review_recalled": 3,
    "false_automation_rate": 0.4,
    "false_automation_count": 2,
    "critical_safety_misses_count": 0,
    "critical_safety_miss_case_ids": [],
    "unsupported_rate": 0.0
  },
  "confusion_matrix": {
    "PRESERVE": {
      "PRESERVE": 0,
      "CONVERT": 0,
      "REFACTOR": 1,
      "MOVE_TO_PLSQL_API": 0,
      "REPLACE_WITH_APEX_NATIVE": 0,
      "MANUAL_REVIEW": 4,
      "DROP": 0,
      "UNMATCHED": 0,
      "UNSUPPORTED": 0
    },
    "CONVERT": {
      "PRESERVE": 0,
      "CONVERT": 3,
      "REFACTOR": 1,
      "MOVE_TO_PLSQL_API": 0,
      "REPLACE_WITH_APEX_NATIVE": 0,
      "MANUAL_REVIEW": 0,
      "DROP": 0,
      "UNMATCHED": 0,
      "UNSUPPORTED": 0
    },
    "REFACTOR": {
      "PRESERVE": 0,
      "CONVERT": 3,
      "REFACTOR": 0,
      "MOVE_TO_PLSQL_API": 0,
      "REPLACE_WITH_APEX_NATIVE": 0,
      "MANUAL_REVIEW": 2,
      "DROP": 0,
      "UNMATCHED": 0,
      "UNSUPPORTED": 0
    },
    "MOVE_TO_PLSQL_API": {
      "PRESERVE": 0,
      "CONVERT": 1,
      "REFACTOR": 4,
      "MOVE_TO_PLSQL_API": 0,
      "REPLACE_WITH_APEX_NATIVE": 0,
      "MANUAL_REVIEW": 0,
      "DROP": 0,
      "UNMATCHED": 0,
      "UNSUPPORTED": 0
    },
    "REPLACE_WITH_APEX_NATIVE": {
      "PRESERVE": 0,
      "CONVERT": 2,
      "REFACTOR": 1,
      "MOVE_TO_PLSQL_API": 0,
      "REPLACE_WITH_APEX_NATIVE": 0,
      "MANUAL_REVIEW": 1,
      "DROP": 0,
      "UNMATCHED": 0,
      "UNSUPPORTED": 0
    },
    "MANUAL_REVIEW": {
      "PRESERVE": 0,
      "CONVERT": 2,
      "REFACTOR": 0,
      "MOVE_TO_PLSQL_API": 0,
      "REPLACE_WITH_APEX_NATIVE": 0,
      "MANUAL_REVIEW": 3,
      "DROP": 0,
      "UNMATCHED": 0,
      "UNSUPPORTED": 0
    },
    "DROP": {
      "PRESERVE": 0,
      "CONVERT": 0,
      "REFACTOR": 0,
      "MOVE_TO_PLSQL_API": 0,
      "REPLACE_WITH_APEX_NATIVE": 0,
      "MANUAL_REVIEW": 0,
      "DROP": 0,
      "UNMATCHED": 0,
      "UNSUPPORTED": 0
    }
  },
  "per_case_results": [
    {
      "case_id": "LOM-MOD-001",
      "title": "Hardcoded business constants in LOM_ORDER_API",
      "observability": "NOT_OBSERVABLE",
      "ground_truth_class": "REFACTOR",
      "predicted_class": null,
      "ground_truth_risk": "MEDIUM",
      "predicted_risk": null,
      "ground_truth_verdict": "NOT_SCORED",
      "predicted_verdict": null,
      "match_status": "NOT_OBSERVABLE",
      "source": "database/packages/lom_order_api.pks (gc_tax_rate, gc_approval_threshold)",
      "engine_evidence": [],
      "raw_finding_ref": null,
      "failure_category": "SOURCE_NOT_INGESTED",
      "notes": "Case source resides exclusively in database packages/DDL/views. Current FormsLang engine does not ingest standalone SQL/PLSQL."
    },
    {
      "case_id": "LOM-MOD-002",
      "title": "Order status transitions enforced only by a hardcoded PL/SQL matrix",
      "observability": "NOT_OBSERVABLE",
      "ground_truth_class": "MANUAL_REVIEW",
      "predicted_class": null,
      "ground_truth_risk": "CRITICAL",
      "predicted_risk": null,
      "ground_truth_verdict": "MANUAL",
      "predicted_verdict": null,
      "match_status": "NOT_OBSERVABLE",
      "source": "database/packages/lom_order_api.pkb (transition_status)",
      "engine_evidence": [],
      "raw_finding_ref": null,
      "failure_category": "SOURCE_NOT_INGESTED",
      "notes": "Case source resides exclusively in database packages/DDL/views. Current FormsLang engine does not ingest standalone SQL/PLSQL."
    },
    {
      "case_id": "LOM-MOD-003",
      "title": "LOM_ORDER_API and LOM_APPROVAL_API call each other (body-level mutual dependency)",
      "observability": "NOT_OBSERVABLE",
      "ground_truth_class": "PRESERVE",
      "predicted_class": null,
      "ground_truth_risk": "LOW",
      "predicted_risk": null,
      "ground_truth_verdict": "NOT_SCORED",
      "predicted_verdict": null,
      "match_status": "NOT_OBSERVABLE",
      "source": "database/packages/lom_order_api.pkb (submit_order -> lom_approval_api.create_approval_request); database/packages/lom_approval_api.pkb (approve/reject -> lom_order_api.transition_status)",
      "engine_evidence": [],
      "raw_finding_ref": null,
      "failure_category": "SOURCE_NOT_INGESTED",
      "notes": "Case source resides exclusively in database packages/DDL/views. Current FormsLang engine does not ingest standalone SQL/PLSQL."
    },
    {
      "case_id": "LOM-MOD-004",
      "title": "LOM_CUSTOMER_TYPES.DEFAULT_CREDIT_LIMIT is a one-time suggestion, never a ceiling",
      "observability": "PARTIALLY_OBSERVABLE",
      "ground_truth_class": "MANUAL_REVIEW",
      "predicted_class": "CONVERT",
      "ground_truth_risk": "LOW",
      "predicted_risk": "HIGH",
      "ground_truth_verdict": "MANUAL",
      "predicted_verdict": "AUTO",
      "match_status": "PREDICTED",
      "source": "database/ddl/lom_lookup_tables.sql (lom_customer_types); forms/xml/CUSTOMERS.xml (WHEN-VALIDATE-ITEM on CUSTOMER_TYPE_CODE, LOM-MOD-012)",
      "engine_evidence": [
        "evidence:0b1b9a3f278db50bd2138894",
        "evidence:0d2799c4fefef2b2e0f49478",
        "evidence:763a55bd7cb18f6eb18ef92a",
        "evidence:945b0ebec782dfd25eda3d0b",
        "evidence:e169613dee39a0e120736ee0",
        "evidence:e2ff3eb1ece08617e78eec2b"
      ],
      "raw_finding_ref": "trigger:5e606896d7ed4b9383072b01",
      "failure_category": "VERDICT_GAP",
      "notes": "Safety miss: case requiring human review was classified as CONVERT."
    },
    {
      "case_id": "LOM-MOD-005",
      "title": "LOM_ORDER_STATUS.SEQUENCE_NO is documentation-only",
      "observability": "NOT_OBSERVABLE",
      "ground_truth_class": "MANUAL_REVIEW",
      "predicted_class": null,
      "ground_truth_risk": "LOW",
      "predicted_risk": null,
      "ground_truth_verdict": "MANUAL",
      "predicted_verdict": null,
      "match_status": "NOT_OBSERVABLE",
      "source": "database/ddl/lom_lookup_tables.sql (lom_order_status, table comment)",
      "engine_evidence": [],
      "raw_finding_ref": null,
      "failure_category": "SOURCE_NOT_INGESTED",
      "notes": "Case source resides exclusively in database packages/DDL/views. Current FormsLang engine does not ingest standalone SQL/PLSQL."
    },
    {
      "case_id": "LOM-MOD-006",
      "title": "OM_SHARED.pll presentation helpers have no PL/SQL to port",
      "observability": "NOT_OBSERVABLE",
      "ground_truth_class": "REPLACE_WITH_APEX_NATIVE",
      "predicted_class": null,
      "ground_truth_risk": "LOW",
      "predicted_risk": null,
      "ground_truth_verdict": "NOT_SCORED",
      "predicted_verdict": null,
      "match_status": "NOT_OBSERVABLE",
      "source": "forms/libraries/OM_SHARED.md (format_currency, show_message, check_user_permission)",
      "engine_evidence": [],
      "raw_finding_ref": null,
      "failure_category": "SOURCE_NOT_INGESTED",
      "notes": "Case source resides in library documentation (OM_SHARED.md). Current FormsLang engine does not ingest non-XML documentation."
    },
    {
      "case_id": "LOM-MOD-007",
      "title": "OM_SHARED.open_form_with_context has no APEX equivalent to preserve",
      "observability": "NOT_OBSERVABLE",
      "ground_truth_class": "DROP",
      "predicted_class": null,
      "ground_truth_risk": "LOW",
      "predicted_risk": null,